{
  "schema_version": "1.0.0",
  "service_kit_version": "1.1.0",
  "application_version": "1.1.0",
  "build_revision": "fixture-additive",
  "profile": "compatibility-fixture",
  "modules": [
    "consumer-contracts",
    "web-realtime",
    "web-search"
  ],
  "contracts": [
    {
      "path": "contracts/asyncapi.json",
      "sha256": "6666666666666666666666666666666666666666666666666666666666666666",
      "required": true
    },
    {
      "path": "contracts/capabilities.json",
      "sha256": "7777777777777777777777777777777777777777777777777777777777777777",
      "required": true
    },
    {
      "path": "contracts/openapi.json",
      "sha256": "8888888888888888888888888888888888888888888888888888888888888888",
      "required": true
    },
    {
      "path": "contracts/permissions.json",
      "sha256": "9999999999999999999999999999999999999999999999999999999999999999",
      "required": true
    }
  ],
  "aggregate_sha256": "aaaaaaaaaaaaaaaaaaaaaaaaaaaaaaaaaaaaaaaaaaaaaaaaaaaaaaaaaaaaaaaa",
  "minimum_sdk_version": "1.0.0",
  "maximum_sdk_version": null,
  "generators": {
    "fixture": "1.1.0"
  }
}
